{
  "$schema": "../decx-tool.schema.json",
  "manifest": 2,
  "summary": "APK/DEX analysis on demand: class lookup and reference search (upstream DroidASC, pure Python, no JVM)",
  "homepage": "https://github.com/MG1937/ASC",
  "license": "Apache-2.0",
  "notes": "DECX creates a private virtualenv and installs the published droidasc package from PyPI; --version pins a PyPI package version",
  "requires": { "python": ">=3.10" },
  "install": ["pip", "install", "droidasc"],
  "launch": { "type": "python", "commands": ["droidasc"] },
  "verify": "--help"
}
