{
  "$schema": "../decx-tool.schema.json",
  "manifest": 2,
  "summary": "Android framework collection and preprocessing: pull framework files, expand them and pack an analyzable jar (AFE)",
  "homepage": "https://github.com/jygzyc/decx",
  "license": "Apache-2.0",
  "notes": "releases are published from this repository under tools-v* tags; every tag carries one archive per platform plus afe-SHA256SUMS.txt, so the manager downloads the asset that belongs to the host",
  "release": {
    "tagPrefix": "tools-v",
    "assets": {
      "darwin-arm64": "afe-{version}-darwin-arm64.tar.gz",
      "darwin-amd64": "afe-{version}-darwin-amd64.tar.gz",
      "linux-amd64": "afe-{version}-linux-amd64.tar.gz",
      "linux-arm64": "afe-{version}-linux-arm64.tar.gz",
      "win-amd64": "afe-{version}-win-amd64.zip",
      "win-arm64": "afe-{version}-win-arm64.zip"
    }
  },
  "install": ["github-release"],
  "launch": { "type": "bin", "commands": ["afe"] },
  "verify": "--version"
}
