{
  "manifest": 2,
  "summary": "Offline Node launcher integration fixture",
  "install": ["github-release"],
  "launch": { "type": "js", "commands": ["jsprobe"] },
  "release": {
    "repository": "acme/jsprobe",
    "tagPrefix": "v",
    "asset": "jsprobe-{version}.tar.gz",
    "checksums": "SHA256SUMS"
  },
  "verify": "--version"
}
